[
  {
    "correlation_explanation": "Suricata HTTP records grouped by flow_id with one HTTP POST anchor. Request and response directions are determined relative to POST. Wazuh FIM is attached only when its host and timestamp meet the configured 60-second rule. FIM link status: unmatched",
    "end_time": "2026-10-09T21:22:33.293645+00:00",
    "entities": {
      "dst_ip": "192.168.186.185",
      "flow_id": "469439295114597",
      "http_url": "/upload",
      "src_ip": "192.168.186.186",
      "sshd_pids": [],
      "user": null
    },
    "evidence_event_ids": [
      "EX-001:suricata_eve.json:1",
      "EX-001:suricata_eve.json:2"
    ],
    "incident_id": "INC-EX-5dfc4cc4e7a1d247",
    "limitations": [
      "HTTP POST and related Suricata evidence do not by themselves prove confidential data exfiltration.",
      "No FIM activity satisfied the configured 60-second correlation rule."
    ],
    "scenario": "http_data_exfiltration",
    "start_time": "2026-10-09T21:19:41.993218+00:00",
    "timeline": [
      {
        "direction": "request",
        "event_ids": [
          "EX-001:suricata_eve.json:1"
        ],
        "link_basis": "flow_id_and_post_anchor",
        "role": "supporting",
        "security_event_type": "http_file_transfer",
        "sshd_pid": null,
        "timestamp": "2026-10-09T21:19:41.993218+00:00"
      },
      {
        "direction": "request",
        "event_ids": [
          "EX-001:suricata_eve.json:2"
        ],
        "link_basis": "flow_id_and_post_anchor",
        "role": "primary",
        "security_event_type": "http_post",
        "sshd_pid": null,
        "timestamp": "2026-10-09T21:22:33.293645+00:00"
      }
    ]
  },
  {
    "correlation_explanation": "Suricata HTTP records grouped by flow_id with one HTTP POST anchor. Request and response directions are determined relative to POST. Wazuh FIM is attached only when its host and timestamp meet the configured 60-second rule. FIM link status: unmatched",
    "end_time": "2026-10-09T21:40:33.243364+00:00",
    "entities": {
      "dst_ip": "192.168.186.185",
      "flow_id": "1384299605536744",
      "http_url": "/upload",
      "src_ip": "192.168.186.186",
      "sshd_pids": [],
      "user": null
    },
    "evidence_event_ids": [
      "EX-001:suricata_eve.json:4",
      "EX-001:suricata_eve.json:5"
    ],
    "incident_id": "INC-EX-435713b2730c580a",
    "limitations": [
      "HTTP POST and related Suricata evidence do not by themselves prove confidential data exfiltration.",
      "No FIM activity satisfied the configured 60-second correlation rule."
    ],
    "scenario": "http_data_exfiltration",
    "start_time": "2026-10-09T21:36:00.160887+00:00",
    "timeline": [
      {
        "direction": "request",
        "event_ids": [
          "EX-001:suricata_eve.json:4"
        ],
        "link_basis": "flow_id_and_post_anchor",
        "role": "supporting",
        "security_event_type": "http_file_transfer",
        "sshd_pid": null,
        "timestamp": "2026-10-09T21:36:00.160887+00:00"
      },
      {
        "direction": "request",
        "event_ids": [
          "EX-001:suricata_eve.json:5"
        ],
        "link_basis": "flow_id_and_post_anchor",
        "role": "primary",
        "security_event_type": "http_post",
        "sshd_pid": null,
        "timestamp": "2026-10-09T21:40:33.243364+00:00"
      }
    ]
  },
  {
    "correlation_explanation": "Suricata HTTP records grouped by flow_id with one HTTP POST anchor. Request and response directions are determined relative to POST. Wazuh FIM is attached only when its host and timestamp meet the configured 60-second rule. FIM link status: unmatched",
    "end_time": "2026-10-09T21:41:50.725137+00:00",
    "entities": {
      "dst_ip": "192.168.186.185",
      "flow_id": "995804804214369",
      "http_url": "/upload",
      "src_ip": "192.168.186.186",
      "sshd_pids": [],
      "user": null
    },
    "evidence_event_ids": [
      "EX-001:suricata_eve.json:7",
      "EX-001:suricata_eve.json:8"
    ],
    "incident_id": "INC-EX-73c1c35577923de0",
    "limitations": [
      "HTTP POST and related Suricata evidence do not by themselves prove confidential data exfiltration.",
      "No FIM activity satisfied the configured 60-second correlation rule."
    ],
    "scenario": "http_data_exfiltration",
    "start_time": "2026-10-09T21:41:50.724705+00:00",
    "timeline": [
      {
        "direction": "request",
        "event_ids": [
          "EX-001:suricata_eve.json:7"
        ],
        "link_basis": "flow_id_and_post_anchor",
        "role": "supporting",
        "security_event_type": "http_file_transfer",
        "sshd_pid": null,
        "timestamp": "2026-10-09T21:41:50.724705+00:00"
      },
      {
        "direction": "request",
        "event_ids": [
          "EX-001:suricata_eve.json:8"
        ],
        "link_basis": "flow_id_and_post_anchor",
        "role": "primary",
        "security_event_type": "http_post",
        "sshd_pid": null,
        "timestamp": "2026-10-09T21:41:50.725137+00:00"
      }
    ]
  },
  {
    "correlation_explanation": "Suricata HTTP records grouped by flow_id with one HTTP POST anchor. Request and response directions are determined relative to POST. Wazuh FIM is attached only when its host and timestamp meet the configured 60-second rule. FIM link status: matched",
    "end_time": "2026-10-09T22:01:41.412016+00:00",
    "entities": {
      "dst_ip": "192.168.186.185",
      "flow_id": "587510258676591",
      "http_url": "/upload",
      "src_ip": "192.168.186.186",
      "sshd_pids": [],
      "user": null
    },
    "evidence_event_ids": [
      "EX-002:alerts.json:1",
      "EX-002:archives.json:1",
      "EX-002:suricata_eve.json:1",
      "EX-002:suricata_eve.json:2",
      "EX-002:suricata_eve.json:3",
      "EX-002:suricata_eve.json:4"
    ],
    "incident_id": "INC-EX-126a741cd41ae18b",
    "limitations": [
      "HTTP POST and related Suricata evidence do not by themselves prove confidential data exfiltration.",
      "FIM is linked by host and temporal proximity; file-content identity and successful transfer are not independently verified."
    ],
    "scenario": "http_data_exfiltration",
    "start_time": "2026-10-09T22:01:41.154000+00:00",
    "timeline": [
      {
        "direction": null,
        "event_ids": [
          "EX-002:alerts.json:1",
          "EX-002:archives.json:1"
        ],
        "link_basis": "same_agent_ip_and_pre_post_60_seconds",
        "role": "supporting",
        "security_event_type": "file_created",
        "sshd_pid": null,
        "timestamp": "2026-10-09T22:01:41.154000+00:00"
      },
      {
        "direction": "request",
        "event_ids": [
          "EX-002:suricata_eve.json:1"
        ],
        "link_basis": "flow_id_and_post_anchor",
        "role": "supporting",
        "security_event_type": "http_file_transfer",
        "sshd_pid": null,
        "timestamp": "2026-10-09T22:01:41.411825+00:00"
      },
      {
        "direction": "response",
        "event_ids": [
          "EX-002:suricata_eve.json:4"
        ],
        "link_basis": "flow_id_and_post_anchor",
        "role": "supporting",
        "security_event_type": "http_file_transfer",
        "sshd_pid": null,
        "timestamp": "2026-10-09T22:01:41.412016+00:00"
      },
      {
        "direction": "request",
        "event_ids": [
          "EX-002:suricata_eve.json:3"
        ],
        "link_basis": "flow_id_and_post_anchor",
        "role": "primary",
        "security_event_type": "http_post",
        "sshd_pid": null,
        "timestamp": "2026-10-09T22:01:41.412016+00:00"
      },
      {
        "direction": "response",
        "event_ids": [
          "EX-002:suricata_eve.json:2"
        ],
        "link_basis": "flow_id_and_post_anchor",
        "role": "supporting",
        "security_event_type": "http_post_context_alert",
        "sshd_pid": null,
        "timestamp": "2026-10-09T22:01:41.412016+00:00"
      }
    ]
  },
  {
    "correlation_explanation": "Suricata HTTP records grouped by flow_id with one HTTP POST anchor. Request and response directions are determined relative to POST. Wazuh FIM is attached only when its host and timestamp meet the configured 60-second rule. FIM link status: matched",
    "end_time": "2026-10-09T22:02:35.205188+00:00",
    "entities": {
      "dst_ip": "192.168.186.185",
      "flow_id": "1184517158803135",
      "http_url": "/upload",
      "src_ip": "192.168.186.186",
      "sshd_pids": [],
      "user": null
    },
    "evidence_event_ids": [
      "EX-002:alerts.json:1",
      "EX-002:archives.json:1",
      "EX-003:alerts.json:1",
      "EX-003:archives.json:1",
      "EX-004:alerts.json:1",
      "EX-004:archives.json:1",
      "EX-005:alerts.json:1",
      "EX-005:archives.json:1",
      "EX-005:suricata_eve.json:1",
      "EX-005:suricata_eve.json:2",
      "EX-005:suricata_eve.json:3",
      "EX-005:suricata_eve.json:4"
    ],
    "incident_id": "INC-EX-4a1f771b53fb3928",
    "limitations": [
      "HTTP POST and related Suricata evidence do not by themselves prove confidential data exfiltration.",
      "FIM is linked by host and temporal proximity; file-content identity and successful transfer are not independently verified."
    ],
    "scenario": "http_data_exfiltration",
    "start_time": "2026-10-09T22:01:41.154000+00:00",
    "timeline": [
      {
        "direction": null,
        "event_ids": [
          "EX-002:alerts.json:1",
          "EX-002:archives.json:1"
        ],
        "link_basis": "same_agent_ip_and_pre_post_60_seconds",
        "role": "supporting",
        "security_event_type": "file_created",
        "sshd_pid": null,
        "timestamp": "2026-10-09T22:01:41.154000+00:00"
      },
      {
        "direction": null,
        "event_ids": [
          "EX-003:alerts.json:1",
          "EX-003:archives.json:1"
        ],
        "link_basis": "same_agent_ip_and_pre_post_60_seconds",